[
  {
    "policy_id": "sample_policy_ai_support_20260616",
    "published_date": "2026-06-16",
    "title": "Synthetic AI compute support notice",
    "jurisdiction": "AU",
    "policy_level": "National",
    "source_name": "Sample Government Department",
    "source_type": "Government",
    "source_url": "https://example.gov/policy/ai-compute-support",
    "evidence_path": "",
    "review_status": "Reviewed",
    "opportunity_type": "IndustrySupport",
    "sectors": "AI, Cloud Infrastructure",
    "affected_entities": "Local AI suppliers, Research teams",
    "impact_summary": "Synthetic official-source opportunity used only to validate the reviewed-input workflow.",
    "required_action": "Verify eligibility, deadlines, constraints, and official terms before any external action.",
    "authority_score": 95,
    "relevance_score": 88,
    "urgency_score": 76,
    "feasibility_score": 72,
    "notes": "Public-safe example. Replace with private reviewed policy evidence under data/private/policy."
  },
  {
    "policy_id": "sample_policy_grid_watch_20260616",
    "published_date": "2026-06-16",
    "title": "Synthetic energy grid consultation",
    "jurisdiction": "AU",
    "policy_level": "Agency",
    "source_name": "Sample Regulator",
    "source_type": "Regulator",
    "source_url": "https://example.gov/policy/grid-consultation",
    "evidence_path": "",
    "review_status": "Reviewed",
    "opportunity_type": "RegulatoryChange",
    "sectors": "Energy, Grid",
    "affected_entities": "Infrastructure operators",
    "impact_summary": "Synthetic reviewed regulator-source watch item.",
    "required_action": "Track consultation timeline and wait for binding rule text.",
    "authority_score": 90,
    "relevance_score": 64,
    "urgency_score": 45,
    "feasibility_score": 50,
    "notes": "Public-safe example."
  }
]
